{
  "$schema": "https://ooxml-cli.dev/schemas/brand.schema.json",
  "name": "Northwind",
  "colors": {
    "seed": "#316F8A"
  },
  "fonts": {
    "heading": "Arial",
    "body": "Liberation Sans",
    "mono": "Liberation Mono",
    "fallbacks": [
      "Aptos",
      "Calibri"
    ]
  },
  "footerText": "Northwind Confidential",
  "slideNumberPolicy": "all",
  "pageSetup": {
    "orientation": "landscape",
    "paperSize": "A4",
    "slideSize": "screen16x9",
    "margins": {
      "top": 0.6,
      "bottom": 0.6,
      "left": 0.8,
      "right": 0.8,
      "header": 0.3,
      "footer": 0.3
    }
  },
  "tableStyle": "TableStyleMedium2"
}
